{
  "$schema": "https://json-schema.org/draft/2020-12/schema",
  "$id": "klode-kit/record.json",
  "title": "Record front matter (records/_by_id/<rec_id>.md)",
  "description": "Effective revision plus candidate revisions (02 r4.1). Top-level status == effective.status; without an effective revision it is the status of the latest candidate (R4-01, x-mirror).",
  "type": "object",
  "additionalProperties": false,
  "required": [
    "rec_id",
    "doc_id",
    "page_id",
    "record_idx",
    "type",
    "status",
    "candidates"
  ],
  "properties": {
    "rec_id": {
      "type": "string",
      "pattern": "^r-[0-9a-f]{12}$"
    },
    "doc_id": {
      "type": "string",
      "pattern": "^d-[0-9a-f]{12}$"
    },
    "page_id": {
      "type": "string",
      "pattern": "^d-[0-9a-f]{12}/p[0-9]{3,}$"
    },
    "record_idx": {
      "type": "integer",
      "minimum": 0
    },
    "type": {
      "type": "string",
      "minLength": 1
    },
    "date": {
      "type": [
        "string",
        "null"
      ],
      "pattern": "^\\d{4}-\\d{2}-\\d{2}$"
    },
    "status": {
      "enum": [
        "extracted",
        "pending_confirm",
        "verified",
        "disputed",
        "none"
      ]
    },
    "effective": {
      "type": "object",
      "additionalProperties": false,
      "required": [
        "rev",
        "audit_rev",
        "status",
        "verified_by"
      ],
      "properties": {
        "rev": {
          "type": "integer",
          "minimum": 1
        },
        "audit_rev": {
          "type": "string",
          "pattern": "^[0-9a-f]{12}/a[0-9]+$"
        },
        "status": {
          "enum": [
            "verified",
            "disputed",
            "none"
          ]
        },
        "verified_by": {
          "enum": [
            "auto",
            "human",
            null
          ]
        }
      },
      "allOf": [
        {
          "if": {
            "required": [
              "status"
            ],
            "properties": {
              "status": {
                "const": "verified"
              }
            }
          },
          "then": {
            "properties": {
              "verified_by": {
                "enum": [
                  "auto",
                  "human"
                ]
              }
            }
          }
        }
      ]
    },
    "candidates": {
      "type": "array",
      "minItems": 1,
      "items": {
        "type": "object",
        "additionalProperties": false,
        "required": [
          "rev",
          "audit_rev",
          "status",
          "uncertain",
          "created"
        ],
        "properties": {
          "rev": {
            "type": "integer",
            "minimum": 1
          },
          "audit_rev": {
            "type": "string",
            "pattern": "^[0-9a-f]{12}/a[0-9]+$"
          },
          "status": {
            "enum": [
              "extracted",
              "pending_confirm",
              "verified",
              "disputed"
            ]
          },
          "uncertain": {
            "type": "array",
            "items": {
              "type": "object",
              "additionalProperties": false,
              "required": [
                "id",
                "reason",
                "scope"
              ],
              "properties": {
                "id": {
                  "type": "string",
                  "minLength": 1
                },
                "reason": {
                  "enum": [
                    "route_failed",
                    "route_missing_page",
                    "parse_error",
                    "unaligned",
                    "merged_rows",
                    "missing_cell",
                    "tie",
                    "all_differ",
                    "swap_suspect",
                    "no_bbox_crop",
                    "degenerate_output",
                    "no_geometry"
                  ]
                },
                "scope": {
                  "enum": [
                    "page",
                    "row",
                    "cell"
                  ]
                },
                "engine": {
                  "enum": [
                    "vision",
                    "mlx",
                    "claude",
                    "codex",
                    "pdftext",
                    "tesseract"
                  ]
                },
                "field_id": {
                  "type": "string",
                  "pattern": "^r-[0-9a-f]{12}/[^/\\s]+$"
                },
                "fix_action": {
                  "type": "string"
                },
                "clear_evidence": {
                  "type": "string"
                },
                "cleared_by": {
                  "enum": [
                    "auto",
                    "human"
                  ]
                },
                "cleared_at": {
                  "type": "string",
                  "pattern": "^\\d{4}-\\d{2}-\\d{2}T\\d{2}:\\d{2}:\\d{2}(\\.\\d+)?(Z|[+-]\\d{2}:\\d{2})$"
                },
                "cleared_evidence": {
                  "type": "string"
                }
              }
            }
          },
          "created": {
            "type": "string",
            "pattern": "^\\d{4}-\\d{2}-\\d{2}T\\d{2}:\\d{2}:\\d{2}(\\.\\d+)?(Z|[+-]\\d{2}:\\d{2})$"
          },
          "superseded_by": {
            "type": "integer",
            "minimum": 1
          }
        }
      }
    }
  },
  "x-mirror": {
    "target": "status",
    "sources": [
      [
        "effective",
        "status"
      ],
      [
        "candidates",
        -1,
        "status"
      ]
    ]
  }
}
